{
  "schema_version": "1.0",
  "advisory_id": "advisory_placeholder",
  "vendor": "other",
  "source": "synthetic",
  "vendor_advisory_id": null,
  "title": "Incomplete synthetic advisory with unknown safety fields",
  "description": null,
  "published_at": "2026-09-15T00:00:00Z",
  "revised_at": null,
  "collected_at": "2026-09-15T12:00:00Z",
  "parser_version": "1.0",
  "cve_ids": [],
  "package_ids": [],
  "references": [],
  "vendor_severity": "unknown",
  "cvss": [],
  "update_category": "unknown",
  "reboot_requirement": "unknown",
  "known_exploited": "unknown",
  "exploitability": "unknown",
  "affected_products": [],
  "remediations": [],
  "prerequisites": [],
  "supersedes": [],
  "superseded_by": [],
  "known_issues": [],
  "vendor_recommendation": null,
  "completeness": "unknown",
  "incomplete_fields": [
    "vendor_severity",
    "reboot_requirement",
    "known_exploited",
    "exploitability",
    "affected_products",
    "update_category"
  ],
  "normalization_confidence": "low",
  "conflicts": [],
  "field_provenance": [],
  "provenance": {
    "source_url": null,
    "raw_sha256": "cccccccccccccccccccccccccccccccccccccccccccccccccccccccccccccccc",
    "retrieved_at": "2026-09-15T12:00:00Z",
    "content_type": null
  }
}
